{
  "$schema": "https://json-schema.org/draft/2020-12/schema",
  "$id": "https://fams.com/schemas/v5-composer/PipelineModuleConfig.schema.json",
  "title": "PipelineModuleConfig",
  "description": "Config for one Pipeline module (work moving through stages — deals, leads, job orders…). Same faithful EAV shape as EntityModuleConfig, but a kanbanCard + a non-empty statusList (>= 2 stages) are required so the kanban view can derive. Stage transitions + RBAC live in the sibling *.rules.json (PipelineRules), referenced from the blueprint's `rules` registry. Every node carries a stable `id`.",
  "type": "object",
  "required": ["code", "name", "systemcolumns", "uiConfig", "listcolumns"],
  "additionalProperties": false,
  "properties": {
    "$schema": { "type": "string" },
    "kind": { "const": "pipeline" },
    "code": { "type": "string", "description": "Entity code in the store, e.g. crm/deals." },
    "name": { "type": "string" },
    "version": { "type": ["string", "number"], "description": "Optional definition version — the cache key for compileFieldSet (phase 2 §2). Bump on any field/placement change; absent → content-hash fallback." },
    "uidPrefix": { "type": "string" },
    "systemcolumns": {
      "type": "array",
      "minItems": 1,
      "items": { "$ref": "EntityModuleConfig.schema.json#/$defs/SystemColumn" }
    },
    "streamcolumns": { "type": "array", "items": { "$ref": "EntityModuleConfig.schema.json#/$defs/SystemColumn" } },
    "datacolumns": { "type": "array", "items": { "$ref": "EntityModuleConfig.schema.json#/$defs/SystemColumn" } },
    "usercolumns": { "type": "array", "items": { "$ref": "EntityModuleConfig.schema.json#/$defs/SystemColumn" } },
    "validation_columns": { "type": "array", "items": { "$ref": "EntityModuleConfig.schema.json#/$defs/SystemColumn" } },
    "uiConfig": {
      "allOf": [
        { "$ref": "EntityModuleConfig.schema.json#/$defs/UiConfig" },
        {
          "type": "object",
          "required": ["statusList", "kanbanCard"],
          "properties": {
            "statusList": { "type": "array", "minItems": 2 }
          }
        }
      ]
    },
    "listcolumns": {
      "type": "array",
      "items": { "$ref": "EntityModuleConfig.schema.json#/$defs/FieldPlacement" }
    },
    "views": {
      "type": "array",
      "items": { "$ref": "EntityModuleConfig.schema.json#/$defs/ViewSpec" },
      "description": "Optional explicit view list for the module's view tabs. An entry is either the bare view KIND (e.g. \"kanban\") — label from the composer's VIEW_LABEL map — or an object { kind, label?, icon? } naming the module's own lens (e.g. { \"kind\": \"dispatcher-cockpit\", \"label\": \"Dispatcher Cockpit\", \"icon\": \"radio\" }). Wins over the module-type's default views when present (see `resolveModuleViews` / `resolveModuleViewSpecs` in `@fams/v5-composer`'s module-registry.ts) — threaded in by the consuming app's blueprint→ModuleBlueprint mapping (e.g. the demo env's `toModuleNode()`)."
    }
  }
}
